{
  "userId": "cmf32xbfs0000on15wpwqrfrr",
  "userDetails": {
    "fullName": "Brad Allen Johnson",
    "birthDate": {
      "day": 1,
      "month": 1,
      "year": 2000
    },
    "birthTime": {
      "hour": 12,
      "minute": 0
    },
    "placeOfBirth": "Port Alberni, Alberni-Clayoquot Regional District, British Columbia, Canada",
    "backgroundGradient": "silver"
  },
  "sealConfig": {
    "centralDesign": "torus-field",
    "category": "Healing & Detoxification",
    "subCategory": "Full Body Detoxification"
  },
  "chatGptInstructions": "```json\n{\n  \"ring1\": [\n    { \"number\": 2, \"color\": \"Orange\", \"position\": \"12:00\", \"reason\": \"Promotes emotional balance and creativity\" },\n    { \"number\": 0, \"color\": \"Silver\", \"position\": \"03:00\", \"reason\": \"Symbolizes potential and new beginnings\" },\n    { \"number\": 0, \"color\": \"Silver\", \"position\": \"06:00\", \"reason\": \"Symbolizes potential and new beginnings\" },\n    { \"number\": 2, \"color\": \"Orange\", \"position\": \"09:00\", \"reason\": \"Promotes emotional balance and creativity\" }\n  ],\n  \"ring2\": [\n    { \"glyph\": \"earth\", \"color\": \"Yellow\", \"position\": \"01:30\", \"reason\": \"Enhances stability and grounding\" },\n    { \"glyph\": \"dragon\", \"color\": \"Green\", \"position\": \"04:30\", \"reason\": \"Brings power, luck, and vitality\" },\n    { \"glyph\": \"liver\", \"color\": \"Green\", \"position\": \"07:30\", \"reason\": \"Supports detoxification and liver health\" },\n    { \"glyph\": \"kidneys\", \"color\": \"Blue\", \"position\": \"10:30\", \"reason\": \"Promotes cleansing and kidney health\" },\n    { \"glyph\": \"ward\", \"color\": \"Violet\", \"position\": \"12:00\", \"reason\": \"For protection and spiritual growth\" },\n    { \"glyph\": \"ward\", \"color\": \"Violet\", \"position\": \"03:00\", \"reason\": \"For protection and spiritual growth\" },\n    { \"glyph\": \"ward\", \"color\": \"Violet\", \"position\": \"06:00\", \"reason\": \"For protection and spiritual growth\" },\n    { \"glyph\": \"ward\", \"color\": \"Violet\", \"position\": \"09:00\", \"reason\": \"For protection and spiritual growth\" }\n  ],\n  \"ring3\": {\n    \"text\": \"Purity, Balance, Renewal\",\n    \"repetitions\": 3\n  },\n  \"summary\": \"This seal array is designed to enhance full body detoxification and healing, supporting emotional balance, new beginnings, and creativity through the use of the number 2 in Orange, symbolizing emotional balance and creativity, and the number 0 in Silver for potential. The Earth and Dragon glyphs provide grounding and vitality, respectively, while the Liver and Kidneys glyphs support organ detoxification. The placement of Ward glyphs offers protective energy. The mantra 'Purity, Balance, Renewal' amplifies the intention of detoxification and harmony within the body.\"\n}\n```",
  "summary": "Welcome to the unveiling of your personalized Seal Array, meticulously crafted to align with your essence and intentions. Anchored in the Torus Field, a symbol of dynamic balance and perpetual motion, this array is dedicated to your journey towards Healing & Detoxification, with a focus on Full Body Detoxification. The chosen geometry and elements within this sacred design are intended to resonate with your path, enhancing vitality and fostering renewal.\n\n**Ring One (Numbers & Colors):** \n- **2 in Orange:** Positioned at 12:00 and 09:00, these elements are your beacons of emotional balance and creativity. The number 2 symbolizes partnership and harmony, guiding you towards inner peace and enhancing your creative spirit. Orange, a color of vitality and enthusiasm, supports this by encouraging emotional equilibrium and inspiring your imaginative capacities.\n- **0 in Silver:** Found at 03:00 and 06:00, the zeros in silver represent the infinite potential and the purity of new beginnings. Zero is the void from which all creation springs, suggesting your capacity for renewal and growth. Silver amplifies this message, bringing clarity, illumination, and a reflective quality to your journey, ensuring you are grounded in your true intentions.\n\n**Ring Two (Glyphs & Colors):**\n- **Earth in Yellow** at 01:30 enhances stability and grounding, essential for any form of healing or detoxification.\n- **Dragon in Green** at 04:30 brings power, luck, and the vital energy necessary for rejuvenation and strength.\n- **Liver in Green** at 07:30 and **Kidneys in Blue** at 10:30 focus on the detoxification of specific organs, vital for cleansing and restoring your body's natural equilibrium.\n- **Ward in Violet** positioned at the cardinal points (12:00, 03:00, 06:00, 09:00) encircles you with protection and spiritual growth, ensuring that your journey towards healing is safeguarded and nurtured by higher energies.\n\n**Ring Three (Affirmation):**\n- **\"Purity, Balance, Renewal\"** repeated thrice, serves as a powerful mantra to amplify the seal's intention. Purity clears the path for healing, balance restores harmony within, and renewal signifies the continuous cycle of growth and transformation. This affirmation is the verbal embodiment of your intention, resonating through the seal to manifest your desires into reality.\n\nIn closing, your Seal Array is a vibrant conduit of energy, charged with the essence of Source Center Vibration. It stands as a living metaphysical tool, attuned to your unique journey towards full body detoxification and well-being. Engage with this sacred geometry with trust and openness, allowing its symbols and affirmations to amplify your intentions and guide you towards vitality, balance, and renewal.",
  "sealImageUrl": "/api/files/generated-seals/seal_Brad_Allen_Johnson_torus-field_1757038802889.json",
  "timestamp": "2025-09-05T02:20:22.540Z"
}